{
  "schema_version": "1.0.0",
  "run_id": "BX-BH01-PHASE9-RUN-ARTIFACTS-LINUX-0.1",
  "status": "observed",
  "captured_at": "2026-09-05T09:47:30.358Z",
  "source_revision": "22dc98033893cdc85db142bd6a05650ab4032f52",
  "environment_id": "BX-BH01-ENV-PHASE9-LINUX-BUILD-X64-0.1",
  "profile_manifest": {
    "id": "BX-BH01-PHASE-05-PROFILE-ASSETS-0.1",
    "sha256": "818ac7b967db6519c766f9d1fff80455cc92d205e3f188252e6da27258ee4aad",
    "governed_files": 23
  },
  "compression": {
    "algorithm": "brotli",
    "quality": 11,
    "repetitions": 3
  },
  "artifacts": [
    {
      "artifact_id": "artifacts/AtomVM.mjs",
      "owner_class": "runtime",
      "reachability_root": "profile-assets-manifest.json",
      "cache_class": "immutable",
      "mime": "text/javascript",
      "source_sha256": "43cbf6ec34cd4745777b4ce70aa23844a6bb8af44c301c86a5dd02c0165bef64",
      "decoded_bytes": 156421,
      "brotli_quality": 11,
      "brotli_bytes": 30831,
      "repetitions": 3,
      "request_count": 1,
      "profile": "PROFILE-BROWSER-PHOENIX",
      "mode": "standalone-dom-feasibility",
      "build_mode": "release-candidate-artifacts"
    },
    {
      "artifact_id": "artifacts/AtomVM.wasm",
      "owner_class": "runtime",
      "reachability_root": "profile-assets-manifest.json",
      "cache_class": "immutable",
      "mime": "application/wasm",
      "source_sha256": "d20c491e75936dc8189910c8d0740093b7813d8dcc1cf966a87c011799ade9d8",
      "decoded_bytes": 986537,
      "brotli_quality": 11,
      "brotli_bytes": 254829,
      "repetitions": 3,
      "request_count": 1,
      "profile": "PROFILE-BROWSER-PHOENIX",
      "mode": "standalone-dom-feasibility",
      "build_mode": "release-candidate-artifacts"
    },
    {
      "artifact_id": "artifacts/bundle.avm",
      "owner_class": "application-bundle-unpruned",
      "reachability_root": "profile-assets-manifest.json",
      "cache_class": "immutable",
      "mime": "application/vnd.atomvm.avm",
      "source_sha256": "e2d9713b17938dbd0886c5e12e927619495b0dc1fd578bf3d79c58de87b94773",
      "decoded_bytes": 6578424,
      "brotli_quality": 11,
      "brotli_bytes": 2199143,
      "repetitions": 3,
      "request_count": 1,
      "profile": "PROFILE-BROWSER-PHOENIX",
      "mode": "standalone-dom-feasibility",
      "build_mode": "release-candidate-artifacts"
    },
    {
      "artifact_id": "deployment-contract.json",
      "owner_class": "loader-bootstrap",
      "reachability_root": "profile-assets-manifest.json",
      "cache_class": "immutable",
      "mime": "application/json",
      "source_sha256": "58c08767d8b3df044dd61982e81a1b38c4087883ed6cc6d148ad86ba047f85b6",
      "decoded_bytes": 2604,
      "brotli_quality": 11,
      "brotli_bytes": 982,
      "repetitions": 3,
      "request_count": 1,
      "profile": "PROFILE-BROWSER-PHOENIX",
      "mode": "standalone-dom-feasibility",
      "build_mode": "release-candidate-artifacts"
    },
    {
      "artifact_id": "dom/fixture-dom-protocol.js",
      "owner_class": "shared-ui-fixture",
      "reachability_root": "profile-assets-manifest.json",
      "cache_class": "immutable",
      "mime": "text/javascript",
      "source_sha256": "8567a6be77448aef313c8e6160c12cb62c0ae6a6e90503e76f011eaafb529c6b",
      "decoded_bytes": 7382,
      "brotli_quality": 11,
      "brotli_bytes": 1888,
      "repetitions": 3,
      "request_count": 1,
      "profile": "PROFILE-BROWSER-PHOENIX",
      "mode": "standalone-dom-feasibility",
      "build_mode": "release-candidate-artifacts"
    },
    {
      "artifact_id": "dom/fixture-dom-renderer.js",
      "owner_class": "shared-ui-fixture",
      "reachability_root": "profile-assets-manifest.json",
      "cache_class": "immutable",
      "mime": "text/javascript",
      "source_sha256": "8d9c2d243239b3af7985864415b9b1750183cf7d98f7e959ea6ea7062daa075c",
      "decoded_bytes": 13679,
      "brotli_quality": 11,
      "brotli_bytes": 3055,
      "repetitions": 3,
      "request_count": 1,
      "profile": "PROFILE-BROWSER-PHOENIX",
      "mode": "standalone-dom-feasibility",
      "build_mode": "release-candidate-artifacts"
    },
    {
      "artifact_id": "host.js",
      "owner_class": "loader-bootstrap",
      "reachability_root": "profile-assets-manifest.json",
      "cache_class": "immutable",
      "mime": "text/javascript",
      "source_sha256": "3cd86fdaa4a184e47ddf4316f2dc0a5aa9ef421dc42f2cab1cfea1280b289043",
      "decoded_bytes": 13957,
      "brotli_quality": 11,
      "brotli_bytes": 3571,
      "repetitions": 3,
      "request_count": 1,
      "profile": "PROFILE-BROWSER-PHOENIX",
      "mode": "standalone-dom-feasibility",
      "build_mode": "release-candidate-artifacts"
    },
    {
      "artifact_id": "index.html",
      "owner_class": "loader-bootstrap",
      "reachability_root": "profile-assets-manifest.json",
      "cache_class": "no-store",
      "mime": "text/html",
      "source_sha256": "e662963edee94292565c86b85cd8c86e82563a054d3021d84cd5bb2497dba990",
      "decoded_bytes": 983,
      "brotli_quality": 11,
      "brotli_bytes": 350,
      "repetitions": 3,
      "request_count": 1,
      "profile": "PROFILE-BROWSER-PHOENIX",
      "mode": "standalone-dom-feasibility",
      "build_mode": "release-candidate-artifacts"
    },
    {
      "artifact_id": "js/bridge-protocol.js",
      "owner_class": "loader-bootstrap",
      "reachability_root": "profile-assets-manifest.json",
      "cache_class": "immutable",
      "mime": "text/javascript",
      "source_sha256": "0dcbc1b119d3c2dad75cfd711846bac40e6bbdc54763bb26c9ea6bdc29d1df97",
      "decoded_bytes": 6496,
      "brotli_quality": 11,
      "brotli_bytes": 1698,
      "repetitions": 3,
      "request_count": 1,
      "profile": "PROFILE-BROWSER-PHOENIX",
      "mode": "standalone-dom-feasibility",
      "build_mode": "release-candidate-artifacts"
    },
    {
      "artifact_id": "js/diagnostic-collector.js",
      "owner_class": "loader-bootstrap",
      "reachability_root": "profile-assets-manifest.json",
      "cache_class": "immutable",
      "mime": "text/javascript",
      "source_sha256": "98d2527ed01793a552a8a1425b8b4079553fcf82108e26a3959bd8c29dc9611b",
      "decoded_bytes": 3129,
      "brotli_quality": 11,
      "brotli_bytes": 937,
      "repetitions": 3,
      "request_count": 1,
      "profile": "PROFILE-BROWSER-PHOENIX",
      "mode": "standalone-dom-feasibility",
      "build_mode": "release-candidate-artifacts"
    },
    {
      "artifact_id": "js/host-bridge.js",
      "owner_class": "loader-bootstrap",
      "reachability_root": "profile-assets-manifest.json",
      "cache_class": "immutable",
      "mime": "text/javascript",
      "source_sha256": "d1e287676bd4f324eea4b1e28fe8caccbed07a46797a8dd0ebd13835e4ac0478",
      "decoded_bytes": 5011,
      "brotli_quality": 11,
      "brotli_bytes": 1413,
      "repetitions": 3,
      "request_count": 1,
      "profile": "PROFILE-BROWSER-PHOENIX",
      "mode": "standalone-dom-feasibility",
      "build_mode": "release-candidate-artifacts"
    },
    {
      "artifact_id": "js/index.js",
      "owner_class": "loader-bootstrap",
      "reachability_root": "profile-assets-manifest.json",
      "cache_class": "immutable",
      "mime": "text/javascript",
      "source_sha256": "9bddc218e4fe4330668670022d0627df4325ec3cb0b90484eaaa77146e9d5eef",
      "decoded_bytes": 1199,
      "brotli_quality": 11,
      "brotli_bytes": 445,
      "repetitions": 3,
      "request_count": 1,
      "profile": "PROFILE-BROWSER-PHOENIX",
      "mode": "standalone-dom-feasibility",
      "build_mode": "release-candidate-artifacts"
    },
    {
      "artifact_id": "js/internal/errors.js",
      "owner_class": "loader-bootstrap",
      "reachability_root": "profile-assets-manifest.json",
      "cache_class": "immutable",
      "mime": "text/javascript",
      "source_sha256": "72325b832d8eda4323815ec5dfe7a68f05dc4795643a33c023a0c5aaab2cca2b",
      "decoded_bytes": 1752,
      "brotli_quality": 11,
      "brotli_bytes": 677,
      "repetitions": 3,
      "request_count": 1,
      "profile": "PROFILE-BROWSER-PHOENIX",
      "mode": "standalone-dom-feasibility",
      "build_mode": "release-candidate-artifacts"
    },
    {
      "artifact_id": "js/lifecycle.js",
      "owner_class": "loader-bootstrap",
      "reachability_root": "profile-assets-manifest.json",
      "cache_class": "immutable",
      "mime": "text/javascript",
      "source_sha256": "ad8b73603f8fbe8f788a60e4461a879f885e681add79cc7f14965c7dec67441e",
      "decoded_bytes": 5505,
      "brotli_quality": 11,
      "brotli_bytes": 1508,
      "repetitions": 3,
      "request_count": 1,
      "profile": "PROFILE-BROWSER-PHOENIX",
      "mode": "standalone-dom-feasibility",
      "build_mode": "release-candidate-artifacts"
    },
    {
      "artifact_id": "js/manifest-loader.js",
      "owner_class": "loader-bootstrap",
      "reachability_root": "profile-assets-manifest.json",
      "cache_class": "immutable",
      "mime": "text/javascript",
      "source_sha256": "64fcf2f80a095c5ab586ec7ad483814837fcb2a0b786f324f67e1fffd4c08114",
      "decoded_bytes": 11538,
      "brotli_quality": 11,
      "brotli_bytes": 2888,
      "repetitions": 3,
      "request_count": 1,
      "profile": "PROFILE-BROWSER-PHOENIX",
      "mode": "standalone-dom-feasibility",
      "build_mode": "release-candidate-artifacts"
    },
    {
      "artifact_id": "js/prerequisites.js",
      "owner_class": "loader-bootstrap",
      "reachability_root": "profile-assets-manifest.json",
      "cache_class": "immutable",
      "mime": "text/javascript",
      "source_sha256": "748e011f2af5e3b1112a420e464ce716f4c9235f90557672cce7df0281b907fa",
      "decoded_bytes": 3190,
      "brotli_quality": 11,
      "brotli_bytes": 885,
      "repetitions": 3,
      "request_count": 1,
      "profile": "PROFILE-BROWSER-PHOENIX",
      "mode": "standalone-dom-feasibility",
      "build_mode": "release-candidate-artifacts"
    },